Category,Variable Name,Description,Measurable,Data Source,Historical Example (2014-2025),Narrative Power,Measurability,Predictive Power,Combined Score
Nobody,Calendar inflation (race count),2014 19 races; 2018 21; 2020 17 (COVID); 2024-25 24 (record) — more races dilute single-race variance and amplify consistency,Yes,F1 calendar archives,5-race expansion 2014→2024 means random DNF cost in % terms went 5.3% to 4.2% of season — consistency rewarded MORE; Rosberg 5-pt margin 2016 over 21 races would have been ~10 pts at 2014 race count,9,10,7,26
Nobody,Triple-header fatigue / long-haul flyaway clustering,3 races in 3 weekends; year-end flyaway Las Vegas-Qatar-Abu Dhabi compressed; engineers/drivers mistake rate rises measurably,Partial,F1 calendar; team radio analysis,2024 Vegas-Qatar-Abu Dhabi triple — Norris penalty at Qatar (3 pts under yellow) came in middle of triple; 2018 Austin-Mexico-Brazil — Vettel third-leg crash in Brazil ended his streak of contention; 2022 5-races/6-wks Asia-Americas late-season,9,6,7,22
Nobody,Time-zone shift between consecutive rounds,Cumulative jet lag across season correlates with mid-FP1 mistakes; Singapore-Japan-Qatar = 7 TZ shifts in 3 weeks,Partial,Calendar geography; sleep-science literature,2023 Asian triple-header drivers complained of fatigue; Sainz Singapore 2023 upset (only non-RB win of 2023) attributed in part to RB compromised on tired engineers,8,4,6,18
Nobody,Track-type clustering in season halves,2024: 6 of first 8 races permanent circuits; 5 of final 8 included street/twilight — drivers/cars suit certain types so clustering creates artificial form,Yes,Circuit-type tagging; FastF1 lap data,2024 Verstappen dominated H1 (perm circuits favored RB20); McLaren MCL38 turned out street-circuit beast — Norris Singapore Miami wins clustered late; reverse the calendar order and title gap likely closes by Brazil,9,8,8,25
Nobody,Stewards' decision variance,Same incident → different penalty by panel composition; 4 stewards rotate only Garry Connelly is permanent on majority,Partial,FIA stewards documents per race; Race regulatory analyses,2021 Silverstone (Hamilton-Verstappen) 10s penalty; 2021 Monza (same pair) 3-place grid drop; 2024 Mexico (Verstappen-Norris) 2x10s penalties; 2024 Austin T12 no penalty for Verstappen on similar move — stewards lottery over 24 weekends is hidden championship variable,10,5,7,22
Nobody,Power-unit grid-penalty accumulation patterns,Each driver allocated 4 ICE/TC/MGU-H/MGU-K; over = grid penalty; clustering of penalties at Spa/Monza is universal,Yes,FIA grid records; Ergast,2016 Hamilton Malaysia engine failure → forced extra PU late season → Spa back-of-grid → ~15 pts lost; 2021 Verstappen Sochi engine penalty back-of-grid → P2; 2023 Perez Belgium grid penalty cluster — engineering decision *when* to take penalty becomes a chess move,9,9,8,26
Nobody,Red-flag/safety-car free-pit-stop benefit,Red flag = free tire change; SC = ~15-20s pit-loss reduction; distribution not random — driver-team strategic positioning matters,Yes,FastF1 race control messages; lap-by-lap data,2021 Abu Dhabi SC restart; 2024 Brazil red flag while Verstappen P5 → restart → P1 (16 pts swing); 2022 Japan confused half-points red-flag rule cost Leclerc 6 pts at championship-deciding round,10,9,8,27
Nobody,Sprint-vs-main-race delta (same driver same weekend),Driver finishes sprint differently than main race — reveals tire-management vs raw pace personality,Yes,F1 results; FastF1,Verstappen 2024 avg sprint finish P1.7 main race P3.1 — sprints favored him; Norris avg sprint P3.4 main P2.5 — sprints hurt him; net delta over 6 sprints Verstappen +14 pts vs Norris in sprint format alone — ~22% of final 63-pt gap,9,10,8,27
Nobody,Race-engineer continuity year-over-year,Driver-engineer pairings build implicit setup language; a change = 0.1-0.3s/lap qualifying loss for ~5 races,Partial,Team announcements; press archives,Hamilton-Bonnington 2014-25 (12 years every Hamilton title); Verstappen-Lambiase since 2016 (every Verstappen title); Leclerc engineer changes 2019/2021/2024 correlate with form dips; Sainz lost Adami to Hamilton end 2024 — visible 2025 settling-in cost,9,5,7,21
Nobody,Driver-market/contract-year effect,Drivers in contract years either over-perform (audition) or crash psychologically,Partial,Press archives; Reuters/Autosport timelines,Sainz 2024 (announced replacement by Hamilton in February): produced career-best — Australia win Singapore podium; Hamilton 2024 last Mercedes year highly inconsistent — Britain win but multiple Q1 exits; Perez 2024 contract extension Mar then collapsed (P8 from P4 prior); Bottas 2021 zero wins until Turkey luck,9,5,7,21
Nobody,Track-evolution rate × Q3 lap timing,Some circuits gain 1.5s+ from FP1 to Q3 (Sakhir Yas Marina Vegas); driver fastest on first push in Q3 vs last lap differs by track,Yes,FastF1 sector times,Vegas 2023 inaugural — track gained 4s+ in 90 min; Sainz pole won on first runs; Hamilton lost ~5 grid spots by waiting; 2024 Sao Paulo (Norris pole; race washout) — track evolution × red-flag rules cost Norris 25+ pts vs Verstappen single biggest swing of 2024,9,8,7,24
Nobody,Points scored outside top-3 finishes (CORE HYPOTHESIS),Sum of all P4-P10 + sprint P4+ points; champion's non-podium accumulation tested vs runner-up,Yes,Ergast/Jolpica per-race results,2024 Verstappen ~122 pts (28% of total) from non-podium finishes vs Norris ~88; 2016 Rosberg 9% non-podium vs Hamilton lower because Hamilton DNFed/back-of-grid more; 2025 Norris 22% non-podium — variable WORKS in close fights (2016 2021 2024 2025) DEGENERATE in dominant-car years (2014 2019 2020 2022 2023),10,10,9,29